Title,Author,Rating,Customers Rated,Price
SSC GD COMBO 2025 (GK+HINDI + MATHS +REASONING),ANKIT BHATI,4.5,65,410.00
,Paperback,3.9,217,1575.00
Prajakta Koli,Prajakta Koli,,Prajakta Koli,319.00
The Psychology of Money,Morgan Housel,4.6,68129,316.00
Amma Diarylo Konni Pageelu,Ravi Mantri,4.8,1225,220.00
RRB NTPC Maths + Samanya Gyan + Reasoning,ANKIT BHATI,3.3,3,377.00
Atomic Habits,James Clear,4.6,99213,547.00
My First Library: Boxset of 10 Board Books for Kids,Wonder House Books,4.5,80993,399.00
"AIBE Bare Acts without Notes | 25 Books Set Combo | Full Syllabus with 50+ Acts with New Criminal Laws BNSS, BNS, BSA | As per Bar Council of India Guidelines | Edition 2025",Lawmann's,4.2,Lawmann's,1568.00
Don't Believe Everything You Think (English),Joseph Nguyen,4.5,8502,187.00
"Educart CBSE Sample Paper Class 10 2024-25 - Science, Mathematics (Standard), Social Science & English Combo Set of 4 Books (with exclusive CBSE Mock Booklets) for 2025 Exam",Educart,4.8,144,1533.00
Dopamine Detox : A Short Guide to Remove Distractions and Get Your Brain to Do Hard Things,Thibaut Meurisse,4.4,11625,199.00
White Nights,Fyodor Dostoyevsky,4.4,Fyodor Dostoyevsky,118.00
Dr Manan Vora,Dr Manan Vora,,Dr Manan Vora,284.00
Oswaal CBSE Sample Question Papers Class 10 Science Book (For 2025 Exam),Oswaal Editorial Board,4.5,56,316.00
The Power of Your Subconscious Mind: Original Edition | Premium Paperback,Joseph Murphy,4.4,13568,141.00
Final Hustle for CBSE Class 10 Science by Padhle - End Time Preparation with Priority Wise Questions Sample Question Papers and Funde (For 2025 Exam),Padhle,4.1,Padhle,449.00
Animals Tales From Panchtantra: Timeless Stories for Children From Ancient India,Wonder House Books,4.5,6112,199.00
Think and Grow Rich: THE 21st CENTURY EDITION,Napoleon Hill,4.4,79226,139.00
ADVANCE MATHS 4500+ MCQs,Ankit Bhati Sir,4.2,Ankit Bhati Sir,299.00
"Story Books for Kids - Second Reader (Illustrated) (Set of 6 Books) - Phonic stories - Bedtime Stories - 3 Years to 6 Years Old - Read Aloud to Infants, Toddlers",Maple Press,4.4,400,150.00
My First Book of Patterns Pencil Control: Patterns Practice book for kids (Pattern Writing),Wonder House Books,4.4,29045,129.00
Educart CBSE Science Class 10 Sample Papers 2024-25 (With exclusive CBSE Mock Booklets for 2025 Exam),Prashant Kirad,4.6,Prashant Kirad,394.00
"1'o Clock Revision book for Science, Maths and Social Science for Class 10th CBSE 2025 (Set of 2) | AI Images | Flowcharts | Tables | Diagrams | Maps and much more, Revise Instantly",KRITI SHARMA,4.4,22,499.00
,Paperback,,Paperback,192.00
Ikigai: Japanese secret to long and happy life,Francesc Miralles,4.6,56681,317.00
"PW CBSE | Class 10 | 15 New Pattern Sample Paper Science, Maths (Std), English & Social Science Combo Set of 4 Books for 2025 Board Exam | 50% Competency Based Questions",PW (Physics Wallah),4.7,156,985.00
"The Vegetarian by Han Kang, Winner of the 2024 Nobel Prize in Literature",Han Kang,3.9,9998,425.00
The Mountain Is You: Transforming Self-Sabotage Into Self-Mastery (English),Brianna Wiest,4.3,20333,262.00
"Oswaal CBSE Sample Question Papers Class 10 English, Science, Social Science & Maths Standard (Set of 4 Books) (For Board Exams 2025)",Oswaal Editorial Board,4.5,289,1365.00
"Courage To Be Disliked, The: How to free yourself, change your life and achieve real happiness",Ichiro Kishimi and Fumitake Koga,4.6,Ichiro Kishimi and Fumitake Koga,339.00
"My First Mythology Tale (Illustrated) (Set of 5 Books) - Mahabharata, Krishna, Hanuman, Ganesha, Ramayana - Story Books for Kids - English Short Stories - Read Aloud to Infants, Toddlers",Maple Press,4.4,9271,182.00
The Psychology of Money – Deluxe Edition,Morgan Housel,4.6,68129,398.00
NTA UGC NET '24 Paper 1 By Kvs Madaan|Teaching And Research Aptitude Net/Set/Jrf|Includes 2023 paper (2 Sets) & 23 years chapter wise solved previous year questions|Includes 2600+ questions,KVS Madaan,4.4,546,349.00
"Brain Activity Book for Kids - 200+ Activities for Age 3+ - Kids Activity Book - Early Learning - Activities for Children - Maths, English, Mazes, Spot the Differences, Word Search - Activity Book for 5 Year Old",Maple Press,4.4,6016,119.00
The Golden Road : How Ancient India Transformed the World,Wlliam Dalrymple,4.6,Wlliam Dalrymple,644.00
PW CBSE | Class 10 | 15 New Pattern Sample Question Papers Science For 2025 Board Exam with 50 Percent Competency Based Questions 100 Most Probable Questions,PW (Physics Wallah),4.0,PW (Physics Wallah),232.00
"NTA UGC NET Paper 1 2024-25: Teaching & Research Aptitude | 3000+ Practice Questions | Solved Previous Years Questions (2014 - 2024) | 100+ Video Lectures, Mind maps & Flowcharts | Online Mock Tests",ARPITA KARWA,4.6,80,529.00
The 5 AM Club – Own Your Morning. Elevate Your Life – Paperback – 19 December 2018,Robin Sharma,4.5,34073,274.00
Oswaal CBSE 25 Combined Sample Question papers Class 10 Books Science Mathematics Standard Social Science English Language and Literature Hindi-A (For 2025 Exam),Oswaal Editorial Board,4.8,112,424.00
"Diary of a Wimpy Kid: Hot Mess (Book 19) (Diary of a Wimpy Kid, 19)",Jeff Kinney,4.7,659,432.00
"MINtile Sank Magic Practice Copybook, (4 Book + 10 Refill) Number Tracing Book for Preschoolers with Pen, Magic Calligraphy Copybook Set Practical Reusable Writing Tool Simple Hand Lettering",Sank Magic,4.0,Sank Magic,110.00
BHAVANI SANKAR KODALI,BHAVANI SANKAR KODALI,,BHAVANI SANKAR KODALI,425.00
Shrimad Bhagwat Geeta Yatharoop (Hindi),A.C. Bhaktivendanta Swami Prabhupada,4.8,20439,234.00
"Oswaal CBSE 25 Combined Sample Question Papers Class 12 Science Books Physics, Chemistry, Biology, Mathematics, English Core (For 2025 Exam)",Oswaal Editorial Board,4.8,68,419.00
All In One English Core class 12th Based On Latest NCERT For CBSE Exams 2025 | Mind map in each chapter | Clear & Concise Theory | Intext & Chapter Exercises | Sample Question Papers,Prerna Kain Srishti Agarwal,4.4,Prerna Kain Srishti Agarwal,333.00
All In One Social Science CBSE Class 10th Based On Latest NCERT For CBSE Exams 2025 | Mind map in each chapter | Clear & Concise Theory | Intext & Chapter Exercises | Sample Question Papers,Susmita Dhar Kriti Arora,4.4,Susmita Dhar Kriti Arora,375.00
Magic of the Lost Temple (Over 2 Lakh Copies sold),Sudha Murty,4.6,Sudha Murty,195.00
The Almanack Of Naval Ravikant: A Guide to Wealth and Happiness,Eric Jorgenson,4.6,19553,257.00
Educart CBSE Mathematics Standard Class 10 Sample Papers 2024-25 (With exclusive CBSE Mock Booklets for 2025 Exam),Mansi Sharma,4.7,Mansi Sharma,395.00
"The Palace of Illusions: 10th Anniversary Edition [Paperback] Banerjee Divakaruni, Chitra",Chitra Banerjee Divakaruni,4.5,10647,313.00
,Paperback,4.3,11,275.00
Oswaal CBSE Sample Question Papers Class 10 English Language & Literature Book (For 2025 Exam),Oswaal Editorial Board,4.7,39,315.00
Nexus: FROM THE MULTI-MILLION COPY BESTSELLING AUTHOR OF SAPIENS,Yuval Noah Harari,4.5,2481,715.00
Metamorphosis,Franz Kafka,4.4,13277,109.00
Oswaal CBSE Sample Question Papers Class 10 Mathematics Basic Book (For 2025 Exam),Oswaal Editorial Board,4.7,35,312.00
PW CBSE 15 New Pattern Sample Question Papers Class 10 Mathematics (Standard Maths) For 2025 Board Exam with 50 Percent Competency Based Questions 100 Most Probable Questions,PW,4.2,PW,231.00
Sapiens: A Brief History of Humankind: The multi-million copy bestseller,Yuval Noah Harari,4.7,120890,486.00
PW CBSE | Class 10 | 15 New Pattern Sample Question Papers Social Science For 2025 Board Exam with 50 Percent Competency Based Questions 100 Most Probable Questions,PW (Physics Wallah),4.3,29,210.00
Oswaal CBSE Question Bank Class 10 Science Chapterwise and Topicwise Solved Papers For Board Exams 2025,Oswaal Editorial Board,4.4,481,582.00
